Test case 1 - SQL single rows
# Source on XXXX-XXXX: ... connected.
SET FOREIGN_KEY_CHECKS=0;
USE `util_test`;
# Exporting data from util_test
# Data for table `util_test`.`t1`:
INSERT INTO `util_test`.`t1` VALUES ('01 Test Basic database example');
INSERT INTO `util_test`.`t1` VALUES ('02 Test Basic database example');
INSERT INTO `util_test`.`t1` VALUES ('03 Test Basic database example');
INSERT INTO `util_test`.`t1` VALUES ('04 Test Basic database example');
INSERT INTO `util_test`.`t1` VALUES ('05 Test Basic database example');
INSERT INTO `util_test`.`t1` VALUES ('06 Test Basic database example');
INSERT INTO `util_test`.`t1` VALUES ('07 Test Basic database example');
# Data for table `util_test`.`t2`:
INSERT INTO `util_test`.`t2` VALUES ('11 Test Basic database example', NULL);
INSERT INTO `util_test`.`t2` VALUES ('12 Test Basic database example', NULL);
INSERT INTO `util_test`.`t2` VALUES ('13 Test Basic database example', NULL);
INSERT INTO `util_test`.`t2` VALUES (NULL, NULL);
# Blob data for table t2:
UPDATE `util_test`.`t2` SET `x_blob` = 'This is a blob.' WHERE `a` = '11 Test Basic database example';
UPDATE `util_test`.`t2` SET `x_blob` = 'This is a blob.' WHERE `a` = '12 Test Basic database example';
UPDATE `util_test`.`t2` SET `x_blob` = 'This is a blob.' WHERE `a` = '13 Test Basic database example';
UPDATE `util_test`.`t2` SET `x_blob` = 'This is a blob.' WHERE `a` = NULL;
# Data for table `util_test`.`t3`:
INSERT INTO `util_test`.`t3` VALUES (1, '14 test fkeys');
INSERT INTO `util_test`.`t3` VALUES (2, '15 test fkeys');
INSERT INTO `util_test`.`t3` VALUES (3, '16 test fkeys');
INSERT INTO `util_test`.`t3` VALUES (4, NULL);
# Data for table `util_test`.`t4`:
INSERT INTO `util_test`.`t4` VALUES (3, 2);
# Data for table `util_test`.`t5`:
INSERT INTO `util_test`.`t5` VALUES (1, 'kitkat', 0.99, 19);
INSERT INTO `util_test`.`t5` VALUES (2, 'M&M', 5.99, 19);
INSERT INTO `util_test`.`t5` VALUES (3, 'milk', 0.67, 5);
INSERT INTO `util_test`.`t5` VALUES (4, 'Dr. Pepper', 0.99, 19);
#...done.
SET FOREIGN_KEY_CHECKS=1;
Test case 2 - SQL bulk insert
# Source on XXXX-XXXX: ... connected.
SET FOREIGN_KEY_CHECKS=0;
USE `util_test`;
# Exporting data from util_test
# Data for table `util_test`.`t1`:
INSERT INTO `util_test`.`t1` VALUES  ('01 Test Basic database example'),  ('02 Test Basic database example'),  ('03 Test Basic database example'),  ('04 Test Basic database example'),  ('05 Test Basic database example'),  ('06 Test Basic database example'),  ('07 Test Basic database example');
# Data for table `util_test`.`t2`:
INSERT INTO `util_test`.`t2` VALUES  ('11 Test Basic database example', NULL),  ('12 Test Basic database example', NULL),  ('13 Test Basic database example', NULL),  (NULL, NULL);
# Blob data for table t2:
UPDATE `util_test`.`t2` SET `x_blob` = 'This is a blob.' WHERE `a` = '11 Test Basic database example';
UPDATE `util_test`.`t2` SET `x_blob` = 'This is a blob.' WHERE `a` = '12 Test Basic database example';
UPDATE `util_test`.`t2` SET `x_blob` = 'This is a blob.' WHERE `a` = '13 Test Basic database example';
UPDATE `util_test`.`t2` SET `x_blob` = 'This is a blob.' WHERE `a` = NULL;
# Data for table `util_test`.`t3`:
INSERT INTO `util_test`.`t3` VALUES  (1, '14 test fkeys'),  (2, '15 test fkeys'),  (3, '16 test fkeys'),  (4, NULL);
# Data for table `util_test`.`t4`:
INSERT INTO `util_test`.`t4` VALUES  (3, 2);
# Data for table `util_test`.`t5`:
INSERT INTO `util_test`.`t5` VALUES  (1, 'kitkat', 0.99, 19),  (2, 'M&M', 5.99, 19),  (3, 'milk', 0.67, 5),  (4, 'Dr. Pepper', 0.99, 19);
#...done.
SET FOREIGN_KEY_CHECKS=1;
Test case 3 - skip blobs
# Source on XXXX-XXXX: ... connected.
SET FOREIGN_KEY_CHECKS=0;
USE `util_test`;
# Exporting data from util_test
# Data for table `util_test`.`t1`:
INSERT INTO `util_test`.`t1` VALUES ('01 Test Basic database example');
INSERT INTO `util_test`.`t1` VALUES ('02 Test Basic database example');
INSERT INTO `util_test`.`t1` VALUES ('03 Test Basic database example');
INSERT INTO `util_test`.`t1` VALUES ('04 Test Basic database example');
INSERT INTO `util_test`.`t1` VALUES ('05 Test Basic database example');
INSERT INTO `util_test`.`t1` VALUES ('06 Test Basic database example');
INSERT INTO `util_test`.`t1` VALUES ('07 Test Basic database example');
# Data for table `util_test`.`t2`:
INSERT INTO `util_test`.`t2` VALUES ('11 Test Basic database example', NULL);
INSERT INTO `util_test`.`t2` VALUES ('12 Test Basic database example', NULL);
INSERT INTO `util_test`.`t2` VALUES ('13 Test Basic database example', NULL);
INSERT INTO `util_test`.`t2` VALUES (NULL, NULL);
# WARNING : Table t2 has blob data that has been excluded by --skip-blobs.
# Data for table `util_test`.`t3`:
INSERT INTO `util_test`.`t3` VALUES (1, '14 test fkeys');
INSERT INTO `util_test`.`t3` VALUES (2, '15 test fkeys');
INSERT INTO `util_test`.`t3` VALUES (3, '16 test fkeys');
INSERT INTO `util_test`.`t3` VALUES (4, NULL);
# Data for table `util_test`.`t4`:
INSERT INTO `util_test`.`t4` VALUES (3, 2);
# Data for table `util_test`.`t5`:
INSERT INTO `util_test`.`t5` VALUES (1, 'kitkat', 0.99, 19);
INSERT INTO `util_test`.`t5` VALUES (2, 'M&M', 5.99, 19);
INSERT INTO `util_test`.`t5` VALUES (3, 'milk', 0.67, 5);
INSERT INTO `util_test`.`t5` VALUES (4, 'Dr. Pepper', 0.99, 19);
#...done.
SET FOREIGN_KEY_CHECKS=1;
Test case 4 - sql format
# Source on XXXX-XXXX: ... connected.
SET FOREIGN_KEY_CHECKS=0;
USE `util_test`;
# Exporting data from util_test
# Data for table `util_test`.`t1`:
INSERT INTO `util_test`.`t1` VALUES ('01 Test Basic database example');
INSERT INTO `util_test`.`t1` VALUES ('02 Test Basic database example');
INSERT INTO `util_test`.`t1` VALUES ('03 Test Basic database example');
INSERT INTO `util_test`.`t1` VALUES ('04 Test Basic database example');
INSERT INTO `util_test`.`t1` VALUES ('05 Test Basic database example');
INSERT INTO `util_test`.`t1` VALUES ('06 Test Basic database example');
INSERT INTO `util_test`.`t1` VALUES ('07 Test Basic database example');
# Data for table `util_test`.`t2`:
INSERT INTO `util_test`.`t2` VALUES ('11 Test Basic database example', NULL);
INSERT INTO `util_test`.`t2` VALUES ('12 Test Basic database example', NULL);
INSERT INTO `util_test`.`t2` VALUES ('13 Test Basic database example', NULL);
INSERT INTO `util_test`.`t2` VALUES (NULL, NULL);
# Blob data for table t2:
UPDATE `util_test`.`t2` SET `x_blob` = 'This is a blob.' WHERE `a` = '11 Test Basic database example';
UPDATE `util_test`.`t2` SET `x_blob` = 'This is a blob.' WHERE `a` = '12 Test Basic database example';
UPDATE `util_test`.`t2` SET `x_blob` = 'This is a blob.' WHERE `a` = '13 Test Basic database example';
UPDATE `util_test`.`t2` SET `x_blob` = 'This is a blob.' WHERE `a` = NULL;
# Data for table `util_test`.`t3`:
INSERT INTO `util_test`.`t3` VALUES (1, '14 test fkeys');
INSERT INTO `util_test`.`t3` VALUES (2, '15 test fkeys');
INSERT INTO `util_test`.`t3` VALUES (3, '16 test fkeys');
INSERT INTO `util_test`.`t3` VALUES (4, NULL);
# Data for table `util_test`.`t4`:
INSERT INTO `util_test`.`t4` VALUES (3, 2);
# Data for table `util_test`.`t5`:
INSERT INTO `util_test`.`t5` VALUES (1, 'kitkat', 0.99, 19);
INSERT INTO `util_test`.`t5` VALUES (2, 'M&M', 5.99, 19);
INSERT INTO `util_test`.`t5` VALUES (3, 'milk', 0.67, 5);
INSERT INTO `util_test`.`t5` VALUES (4, 'Dr. Pepper', 0.99, 19);
#...done.
SET FOREIGN_KEY_CHECKS=1;
Test case 5 - csv format
# Source on XXXX-XXXX: ... connected.
SET FOREIGN_KEY_CHECKS=0;
# Exporting data from util_test
# Data for table `util_test`.`t1`:
`a`
01 Test Basic database example
02 Test Basic database example
03 Test Basic database example
04 Test Basic database example
05 Test Basic database example
06 Test Basic database example
07 Test Basic database example
# Data for table `util_test`.`t2`:
`a`,`x_blob`
11 Test Basic database example,This is a blob.
12 Test Basic database example,This is a blob.
13 Test Basic database example,This is a blob.
NULL,This is a blob.
# Data for table `util_test`.`t3`:
`a`,`b`
1,14 test fkeys
2,15 test fkeys
3,16 test fkeys
4,NULL
# Data for table `util_test`.`t4`:
`c`,`d`
3,2
# Data for table `util_test`.`t5`:
`product_id`,`name`,`base_price`,`tax_percentage`
1,kitkat,0.99,19
2,M&M,5.99,19
3,milk,0.67,5
4,Dr. Pepper,0.99,19
#...done.
SET FOREIGN_KEY_CHECKS=1;
Test case 6 - tab format
# Source on XXXX-XXXX: ... connected.
SET FOREIGN_KEY_CHECKS=0;
# Exporting data from util_test
# Data for table `util_test`.`t1`:
`a`
01 Test Basic database example
02 Test Basic database example
03 Test Basic database example
04 Test Basic database example
05 Test Basic database example
06 Test Basic database example
07 Test Basic database example
# Data for table `util_test`.`t2`:
`a`	`x_blob`
11 Test Basic database example	This is a blob.
12 Test Basic database example	This is a blob.
13 Test Basic database example	This is a blob.
NULL	This is a blob.
# Data for table `util_test`.`t3`:
`a`	`b`
1	14 test fkeys
2	15 test fkeys
3	16 test fkeys
4	NULL
# Data for table `util_test`.`t4`:
`c`	`d`
3	2
# Data for table `util_test`.`t5`:
`product_id`	`name`	`base_price`	`tax_percentage`
1	kitkat	0.99	19
2	M&M	5.99	19
3	milk	0.67	5
4	Dr. Pepper	0.99	19
#...done.
SET FOREIGN_KEY_CHECKS=1;
Test case 7 - GRID format
# Source on XXXX-XXXX: ... connected.
SET FOREIGN_KEY_CHECKS=0;
# Exporting data from util_test
# Data for table `util_test`.`t1`:
+---------------------------------+
| a                               |
+---------------------------------+
| 01 Test Basic database example  |
| 02 Test Basic database example  |
| 03 Test Basic database example  |
| 04 Test Basic database example  |
| 05 Test Basic database example  |
| 06 Test Basic database example  |
| 07 Test Basic database example  |
+---------------------------------+
# Data for table `util_test`.`t2`:
+---------------------------------+------------------+
| a                               | x_blob           |
+---------------------------------+------------------+
| 11 Test Basic database example  | This is a blob.  |
| 12 Test Basic database example  | This is a blob.  |
| 13 Test Basic database example  | This is a blob.  |
| NULL                            | This is a blob.  |
+---------------------------------+------------------+
# Data for table `util_test`.`t3`:
+----+----------------+
| a  | b              |
+----+----------------+
| 1  | 14 test fkeys  |
| 2  | 15 test fkeys  |
| 3  | 16 test fkeys  |
| 4  | NULL           |
+----+----------------+
# Data for table `util_test`.`t4`:
+----+----+
| c  | d  |
+----+----+
| 3  | 2  |
+----+----+
# Data for table `util_test`.`t5`:
+-------------+-------------+-------------+-----------------+
| product_id  | name        | base_price  | tax_percentage  |
+-------------+-------------+-------------+-----------------+
| 1           | kitkat      | 0.99        | 19              |
| 2           | M&M         | 5.99        | 19              |
| 3           | milk        | 0.67        | 5               |
| 4           | Dr. Pepper  | 0.99        | 19              |
+-------------+-------------+-------------+-----------------+
#...done.
SET FOREIGN_KEY_CHECKS=1;
Test case 8 - VERTICAL format
# Source on XXXX-XXXX: ... connected.
SET FOREIGN_KEY_CHECKS=0;
# Exporting data from util_test
# Data for table `util_test`.`t1`:
*************************       1. row *************************
 a: 01 Test Basic database example
*************************       2. row *************************
 a: 02 Test Basic database example
*************************       3. row *************************
 a: 03 Test Basic database example
*************************       4. row *************************
 a: 04 Test Basic database example
*************************       5. row *************************
 a: 05 Test Basic database example
*************************       6. row *************************
 a: 06 Test Basic database example
*************************       7. row *************************
 a: 07 Test Basic database example
7 rows.
# Data for table `util_test`.`t2`:
*************************       1. row *************************
      a: 11 Test Basic database example
 x_blob: This is a blob.
*************************       2. row *************************
      a: 12 Test Basic database example
 x_blob: This is a blob.
*************************       3. row *************************
      a: 13 Test Basic database example
 x_blob: This is a blob.
*************************       4. row *************************
      a: NULL
 x_blob: This is a blob.
4 rows.
# Data for table `util_test`.`t3`:
*************************       1. row *************************
 a: 1
 b: 14 test fkeys
*************************       2. row *************************
 a: 2
 b: 15 test fkeys
*************************       3. row *************************
 a: 3
 b: 16 test fkeys
*************************       4. row *************************
 a: 4
 b: NULL
4 rows.
# Data for table `util_test`.`t4`:
*************************       1. row *************************
 c: 3
 d: 2
1 row.
# Data for table `util_test`.`t5`:
*************************       1. row *************************
     product_id: 1
           name: kitkat
     base_price: 0.99
 tax_percentage: 19
*************************       2. row *************************
     product_id: 2
           name: M&M
     base_price: 5.99
 tax_percentage: 19
*************************       3. row *************************
     product_id: 3
           name: milk
     base_price: 0.67
 tax_percentage: 5
*************************       4. row *************************
     product_id: 4
           name: Dr. Pepper
     base_price: 0.99
 tax_percentage: 19
4 rows.
#...done.
SET FOREIGN_KEY_CHECKS=1;
Test case 9 - sql format no headers
# Source on XXXX-XXXX: ... connected.
SET FOREIGN_KEY_CHECKS=0;
USE `util_test`;
# Exporting data from util_test
# Data for table `util_test`.`t1`:
INSERT INTO `util_test`.`t1` VALUES ('01 Test Basic database example');
INSERT INTO `util_test`.`t1` VALUES ('02 Test Basic database example');
INSERT INTO `util_test`.`t1` VALUES ('03 Test Basic database example');
INSERT INTO `util_test`.`t1` VALUES ('04 Test Basic database example');
INSERT INTO `util_test`.`t1` VALUES ('05 Test Basic database example');
INSERT INTO `util_test`.`t1` VALUES ('06 Test Basic database example');
INSERT INTO `util_test`.`t1` VALUES ('07 Test Basic database example');
# Data for table `util_test`.`t2`:
INSERT INTO `util_test`.`t2` VALUES ('11 Test Basic database example', NULL);
INSERT INTO `util_test`.`t2` VALUES ('12 Test Basic database example', NULL);
INSERT INTO `util_test`.`t2` VALUES ('13 Test Basic database example', NULL);
INSERT INTO `util_test`.`t2` VALUES (NULL, NULL);
# Blob data for table t2:
UPDATE `util_test`.`t2` SET `x_blob` = 'This is a blob.' WHERE `a` = '11 Test Basic database example';
UPDATE `util_test`.`t2` SET `x_blob` = 'This is a blob.' WHERE `a` = '12 Test Basic database example';
UPDATE `util_test`.`t2` SET `x_blob` = 'This is a blob.' WHERE `a` = '13 Test Basic database example';
UPDATE `util_test`.`t2` SET `x_blob` = 'This is a blob.' WHERE `a` = NULL;
# Data for table `util_test`.`t3`:
INSERT INTO `util_test`.`t3` VALUES (1, '14 test fkeys');
INSERT INTO `util_test`.`t3` VALUES (2, '15 test fkeys');
INSERT INTO `util_test`.`t3` VALUES (3, '16 test fkeys');
INSERT INTO `util_test`.`t3` VALUES (4, NULL);
# Data for table `util_test`.`t4`:
INSERT INTO `util_test`.`t4` VALUES (3, 2);
# Data for table `util_test`.`t5`:
INSERT INTO `util_test`.`t5` VALUES (1, 'kitkat', 0.99, 19);
INSERT INTO `util_test`.`t5` VALUES (2, 'M&M', 5.99, 19);
INSERT INTO `util_test`.`t5` VALUES (3, 'milk', 0.67, 5);
INSERT INTO `util_test`.`t5` VALUES (4, 'Dr. Pepper', 0.99, 19);
#...done.
SET FOREIGN_KEY_CHECKS=1;
Test case 10 - csv format no headers
# Source on XXXX-XXXX: ... connected.
SET FOREIGN_KEY_CHECKS=0;
# Exporting data from util_test
# Data for table `util_test`.`t1`:
`a`
01 Test Basic database example
02 Test Basic database example
03 Test Basic database example
04 Test Basic database example
05 Test Basic database example
06 Test Basic database example
07 Test Basic database example
# Data for table `util_test`.`t2`:
`a`,`x_blob`
11 Test Basic database example,This is a blob.
12 Test Basic database example,This is a blob.
13 Test Basic database example,This is a blob.
NULL,This is a blob.
# Data for table `util_test`.`t3`:
`a`,`b`
1,14 test fkeys
2,15 test fkeys
3,16 test fkeys
4,NULL
# Data for table `util_test`.`t4`:
`c`,`d`
3,2
# Data for table `util_test`.`t5`:
`product_id`,`name`,`base_price`,`tax_percentage`
1,kitkat,0.99,19
2,M&M,5.99,19
3,milk,0.67,5
4,Dr. Pepper,0.99,19
#...done.
SET FOREIGN_KEY_CHECKS=1;
Test case 11 - tab format no headers
# Source on XXXX-XXXX: ... connected.
SET FOREIGN_KEY_CHECKS=0;
# Exporting data from util_test
# Data for table `util_test`.`t1`:
`a`
01 Test Basic database example
02 Test Basic database example
03 Test Basic database example
04 Test Basic database example
05 Test Basic database example
06 Test Basic database example
07 Test Basic database example
# Data for table `util_test`.`t2`:
`a`	`x_blob`
11 Test Basic database example	This is a blob.
12 Test Basic database example	This is a blob.
13 Test Basic database example	This is a blob.
NULL	This is a blob.
# Data for table `util_test`.`t3`:
`a`	`b`
1	14 test fkeys
2	15 test fkeys
3	16 test fkeys
4	NULL
# Data for table `util_test`.`t4`:
`c`	`d`
3	2
# Data for table `util_test`.`t5`:
`product_id`	`name`	`base_price`	`tax_percentage`
1	kitkat	0.99	19
2	M&M	5.99	19
3	milk	0.67	5
4	Dr. Pepper	0.99	19
#...done.
SET FOREIGN_KEY_CHECKS=1;
Test case 12 - GRID format no headers
# Source on XXXX-XXXX: ... connected.
SET FOREIGN_KEY_CHECKS=0;
# Exporting data from util_test
# Data for table `util_test`.`t1`:
+---------------------------------+
| a                               |
+---------------------------------+
| 01 Test Basic database example  |
| 02 Test Basic database example  |
| 03 Test Basic database example  |
| 04 Test Basic database example  |
| 05 Test Basic database example  |
| 06 Test Basic database example  |
| 07 Test Basic database example  |
+---------------------------------+
# Data for table `util_test`.`t2`:
+---------------------------------+------------------+
| a                               | x_blob           |
+---------------------------------+------------------+
| 11 Test Basic database example  | This is a blob.  |
| 12 Test Basic database example  | This is a blob.  |
| 13 Test Basic database example  | This is a blob.  |
| NULL                            | This is a blob.  |
+---------------------------------+------------------+
# Data for table `util_test`.`t3`:
+----+----------------+
| a  | b              |
+----+----------------+
| 1  | 14 test fkeys  |
| 2  | 15 test fkeys  |
| 3  | 16 test fkeys  |
| 4  | NULL           |
+----+----------------+
# Data for table `util_test`.`t4`:
+----+----+
| c  | d  |
+----+----+
| 3  | 2  |
+----+----+
# Data for table `util_test`.`t5`:
+-------------+-------------+-------------+-----------------+
| product_id  | name        | base_price  | tax_percentage  |
+-------------+-------------+-------------+-----------------+
| 1           | kitkat      | 0.99        | 19              |
| 2           | M&M         | 5.99        | 19              |
| 3           | milk        | 0.67        | 5               |
| 4           | Dr. Pepper  | 0.99        | 19              |
+-------------+-------------+-------------+-----------------+
#...done.
SET FOREIGN_KEY_CHECKS=1;
Test case 13 - VERTICAL format no headers
# Source on XXXX-XXXX: ... connected.
SET FOREIGN_KEY_CHECKS=0;
# Exporting data from util_test
# Data for table `util_test`.`t1`:
*************************       1. row *************************
 a: 01 Test Basic database example
*************************       2. row *************************
 a: 02 Test Basic database example
*************************       3. row *************************
 a: 03 Test Basic database example
*************************       4. row *************************
 a: 04 Test Basic database example
*************************       5. row *************************
 a: 05 Test Basic database example
*************************       6. row *************************
 a: 06 Test Basic database example
*************************       7. row *************************
 a: 07 Test Basic database example
7 rows.
# Data for table `util_test`.`t2`:
*************************       1. row *************************
      a: 11 Test Basic database example
 x_blob: This is a blob.
*************************       2. row *************************
      a: 12 Test Basic database example
 x_blob: This is a blob.
*************************       3. row *************************
      a: 13 Test Basic database example
 x_blob: This is a blob.
*************************       4. row *************************
      a: NULL
 x_blob: This is a blob.
4 rows.
# Data for table `util_test`.`t3`:
*************************       1. row *************************
 a: 1
 b: 14 test fkeys
*************************       2. row *************************
 a: 2
 b: 15 test fkeys
*************************       3. row *************************
 a: 3
 b: 16 test fkeys
*************************       4. row *************************
 a: 4
 b: NULL
4 rows.
# Data for table `util_test`.`t4`:
*************************       1. row *************************
 c: 3
 d: 2
1 row.
# Data for table `util_test`.`t5`:
*************************       1. row *************************
     product_id: 1
           name: kitkat
     base_price: 0.99
 tax_percentage: 19
*************************       2. row *************************
     product_id: 2
           name: M&M
     base_price: 5.99
 tax_percentage: 19
*************************       3. row *************************
     product_id: 3
           name: milk
     base_price: 0.67
 tax_percentage: 5
*************************       4. row *************************
     product_id: 4
           name: Dr. Pepper
     base_price: 0.99
 tax_percentage: 19
4 rows.
#...done.
SET FOREIGN_KEY_CHECKS=1;
Test case 14 - SQ format
# Source on XXXX-XXXX: ... connected.
SET FOREIGN_KEY_CHECKS=0;
USE `util_test`;
# Exporting data from util_test
# Data for table `util_test`.`t1`:
INSERT INTO `util_test`.`t1` VALUES ('01 Test Basic database example');
INSERT INTO `util_test`.`t1` VALUES ('02 Test Basic database example');
INSERT INTO `util_test`.`t1` VALUES ('03 Test Basic database example');
INSERT INTO `util_test`.`t1` VALUES ('04 Test Basic database example');
INSERT INTO `util_test`.`t1` VALUES ('05 Test Basic database example');
INSERT INTO `util_test`.`t1` VALUES ('06 Test Basic database example');
INSERT INTO `util_test`.`t1` VALUES ('07 Test Basic database example');
# Data for table `util_test`.`t2`:
INSERT INTO `util_test`.`t2` VALUES ('11 Test Basic database example', NULL);
INSERT INTO `util_test`.`t2` VALUES ('12 Test Basic database example', NULL);
INSERT INTO `util_test`.`t2` VALUES ('13 Test Basic database example', NULL);
INSERT INTO `util_test`.`t2` VALUES (NULL, NULL);
# Blob data for table t2:
UPDATE `util_test`.`t2` SET `x_blob` = 'This is a blob.' WHERE `a` = '11 Test Basic database example';
UPDATE `util_test`.`t2` SET `x_blob` = 'This is a blob.' WHERE `a` = '12 Test Basic database example';
UPDATE `util_test`.`t2` SET `x_blob` = 'This is a blob.' WHERE `a` = '13 Test Basic database example';
UPDATE `util_test`.`t2` SET `x_blob` = 'This is a blob.' WHERE `a` = NULL;
# Data for table `util_test`.`t3`:
INSERT INTO `util_test`.`t3` VALUES (1, '14 test fkeys');
INSERT INTO `util_test`.`t3` VALUES (2, '15 test fkeys');
INSERT INTO `util_test`.`t3` VALUES (3, '16 test fkeys');
INSERT INTO `util_test`.`t3` VALUES (4, NULL);
# Data for table `util_test`.`t4`:
INSERT INTO `util_test`.`t4` VALUES (3, 2);
# Data for table `util_test`.`t5`:
INSERT INTO `util_test`.`t5` VALUES (1, 'kitkat', 0.99, 19);
INSERT INTO `util_test`.`t5` VALUES (2, 'M&M', 5.99, 19);
INSERT INTO `util_test`.`t5` VALUES (3, 'milk', 0.67, 5);
INSERT INTO `util_test`.`t5` VALUES (4, 'Dr. Pepper', 0.99, 19);
#...done.
SET FOREIGN_KEY_CHECKS=1;
Test case 15 - CS format
# Source on XXXX-XXXX: ... connected.
SET FOREIGN_KEY_CHECKS=0;
# Exporting data from util_test
# Data for table `util_test`.`t1`:
`a`
01 Test Basic database example
02 Test Basic database example
03 Test Basic database example
04 Test Basic database example
05 Test Basic database example
06 Test Basic database example
07 Test Basic database example
# Data for table `util_test`.`t2`:
`a`,`x_blob`
11 Test Basic database example,This is a blob.
12 Test Basic database example,This is a blob.
13 Test Basic database example,This is a blob.
NULL,This is a blob.
# Data for table `util_test`.`t3`:
`a`,`b`
1,14 test fkeys
2,15 test fkeys
3,16 test fkeys
4,NULL
# Data for table `util_test`.`t4`:
`c`,`d`
3,2
# Data for table `util_test`.`t5`:
`product_id`,`name`,`base_price`,`tax_percentage`
1,kitkat,0.99,19
2,M&M,5.99,19
3,milk,0.67,5
4,Dr. Pepper,0.99,19
#...done.
SET FOREIGN_KEY_CHECKS=1;
Test case 16 - ta format
# Source on XXXX-XXXX: ... connected.
SET FOREIGN_KEY_CHECKS=0;
# Exporting data from util_test
# Data for table `util_test`.`t1`:
`a`
01 Test Basic database example
02 Test Basic database example
03 Test Basic database example
04 Test Basic database example
05 Test Basic database example
06 Test Basic database example
07 Test Basic database example
# Data for table `util_test`.`t2`:
`a`	`x_blob`
11 Test Basic database example	This is a blob.
12 Test Basic database example	This is a blob.
13 Test Basic database example	This is a blob.
NULL	This is a blob.
# Data for table `util_test`.`t3`:
`a`	`b`
1	14 test fkeys
2	15 test fkeys
3	16 test fkeys
4	NULL
# Data for table `util_test`.`t4`:
`c`	`d`
3	2
# Data for table `util_test`.`t5`:
`product_id`	`name`	`base_price`	`tax_percentage`
1	kitkat	0.99	19
2	M&M	5.99	19
3	milk	0.67	5
4	Dr. Pepper	0.99	19
#...done.
SET FOREIGN_KEY_CHECKS=1;
Test case 17 - g format
# Source on XXXX-XXXX: ... connected.
SET FOREIGN_KEY_CHECKS=0;
# Exporting data from util_test
# Data for table `util_test`.`t1`:
+---------------------------------+
| a                               |
+---------------------------------+
| 01 Test Basic database example  |
| 02 Test Basic database example  |
| 03 Test Basic database example  |
| 04 Test Basic database example  |
| 05 Test Basic database example  |
| 06 Test Basic database example  |
| 07 Test Basic database example  |
+---------------------------------+
# Data for table `util_test`.`t2`:
+---------------------------------+------------------+
| a                               | x_blob           |
+---------------------------------+------------------+
| 11 Test Basic database example  | This is a blob.  |
| 12 Test Basic database example  | This is a blob.  |
| 13 Test Basic database example  | This is a blob.  |
| NULL                            | This is a blob.  |
+---------------------------------+------------------+
# Data for table `util_test`.`t3`:
+----+----------------+
| a  | b              |
+----+----------------+
| 1  | 14 test fkeys  |
| 2  | 15 test fkeys  |
| 3  | 16 test fkeys  |
| 4  | NULL           |
+----+----------------+
# Data for table `util_test`.`t4`:
+----+----+
| c  | d  |
+----+----+
| 3  | 2  |
+----+----+
# Data for table `util_test`.`t5`:
+-------------+-------------+-------------+-----------------+
| product_id  | name        | base_price  | tax_percentage  |
+-------------+-------------+-------------+-----------------+
| 1           | kitkat      | 0.99        | 19              |
| 2           | M&M         | 5.99        | 19              |
| 3           | milk        | 0.67        | 5               |
| 4           | Dr. Pepper  | 0.99        | 19              |
+-------------+-------------+-------------+-----------------+
#...done.
SET FOREIGN_KEY_CHECKS=1;
Test case 18 - v format
# Source on XXXX-XXXX: ... connected.
SET FOREIGN_KEY_CHECKS=0;
# Exporting data from util_test
# Data for table `util_test`.`t1`:
*************************       1. row *************************
 a: 01 Test Basic database example
*************************       2. row *************************
 a: 02 Test Basic database example
*************************       3. row *************************
 a: 03 Test Basic database example
*************************       4. row *************************
 a: 04 Test Basic database example
*************************       5. row *************************
 a: 05 Test Basic database example
*************************       6. row *************************
 a: 06 Test Basic database example
*************************       7. row *************************
 a: 07 Test Basic database example
7 rows.
# Data for table `util_test`.`t2`:
*************************       1. row *************************
      a: 11 Test Basic database example
 x_blob: This is a blob.
*************************       2. row *************************
      a: 12 Test Basic database example
 x_blob: This is a blob.
*************************       3. row *************************
      a: 13 Test Basic database example
 x_blob: This is a blob.
*************************       4. row *************************
      a: NULL
 x_blob: This is a blob.
4 rows.
# Data for table `util_test`.`t3`:
*************************       1. row *************************
 a: 1
 b: 14 test fkeys
*************************       2. row *************************
 a: 2
 b: 15 test fkeys
*************************       3. row *************************
 a: 3
 b: 16 test fkeys
*************************       4. row *************************
 a: 4
 b: NULL
4 rows.
# Data for table `util_test`.`t4`:
*************************       1. row *************************
 c: 3
 d: 2
1 row.
# Data for table `util_test`.`t5`:
*************************       1. row *************************
     product_id: 1
           name: kitkat
     base_price: 0.99
 tax_percentage: 19
*************************       2. row *************************
     product_id: 2
           name: M&M
     base_price: 5.99
 tax_percentage: 19
*************************       3. row *************************
     product_id: 3
           name: milk
     base_price: 0.67
 tax_percentage: 5
*************************       4. row *************************
     product_id: 4
           name: Dr. Pepper
     base_price: 0.99
 tax_percentage: 19
4 rows.
#...done.
SET FOREIGN_KEY_CHECKS=1;
Test case 19 - GRID format with BRIEF display
# Source on XXXX-XXXX: ... connected.
SET FOREIGN_KEY_CHECKS=0;
# Exporting data from util_test
# Data for table `util_test`.`t1`:
+---------------------------------+
| a                               |
+---------------------------------+
| 01 Test Basic database example  |
| 02 Test Basic database example  |
| 03 Test Basic database example  |
| 04 Test Basic database example  |
| 05 Test Basic database example  |
| 06 Test Basic database example  |
| 07 Test Basic database example  |
+---------------------------------+
# Data for table `util_test`.`t2`:
+---------------------------------+------------------+
| a                               | x_blob           |
+---------------------------------+------------------+
| 11 Test Basic database example  | This is a blob.  |
| 12 Test Basic database example  | This is a blob.  |
| 13 Test Basic database example  | This is a blob.  |
| NULL                            | This is a blob.  |
+---------------------------------+------------------+
# Data for table `util_test`.`t3`:
+----+----------------+
| a  | b              |
+----+----------------+
| 1  | 14 test fkeys  |
| 2  | 15 test fkeys  |
| 3  | 16 test fkeys  |
| 4  | NULL           |
+----+----------------+
# Data for table `util_test`.`t4`:
+----+----+
| c  | d  |
+----+----+
| 3  | 2  |
+----+----+
# Data for table `util_test`.`t5`:
+-------------+-------------+-------------+-----------------+
| product_id  | name        | base_price  | tax_percentage  |
+-------------+-------------+-------------+-----------------+
| 1           | kitkat      | 0.99        | 19              |
| 2           | M&M         | 5.99        | 19              |
| 3           | milk        | 0.67        | 5               |
| 4           | Dr. Pepper  | 0.99        | 19              |
+-------------+-------------+-------------+-----------------+
#...done.
SET FOREIGN_KEY_CHECKS=1;
Test case 20 - GRID format with FULL display
# Source on XXXX-XXXX: ... connected.
SET FOREIGN_KEY_CHECKS=0;
# NOTE : --display is ignored for data export.
# Exporting data from util_test
# Data for table `util_test`.`t1`:
+---------------------------------+
| a                               |
+---------------------------------+
| 01 Test Basic database example  |
| 02 Test Basic database example  |
| 03 Test Basic database example  |
| 04 Test Basic database example  |
| 05 Test Basic database example  |
| 06 Test Basic database example  |
| 07 Test Basic database example  |
+---------------------------------+
# Data for table `util_test`.`t2`:
+---------------------------------+------------------+
| a                               | x_blob           |
+---------------------------------+------------------+
| 11 Test Basic database example  | This is a blob.  |
| 12 Test Basic database example  | This is a blob.  |
| 13 Test Basic database example  | This is a blob.  |
| NULL                            | This is a blob.  |
+---------------------------------+------------------+
# Data for table `util_test`.`t3`:
+----+----------------+
| a  | b              |
+----+----------------+
| 1  | 14 test fkeys  |
| 2  | 15 test fkeys  |
| 3  | 16 test fkeys  |
| 4  | NULL           |
+----+----------------+
# Data for table `util_test`.`t4`:
+----+----+
| c  | d  |
+----+----+
| 3  | 2  |
+----+----+
# Data for table `util_test`.`t5`:
+-------------+-------------+-------------+-----------------+
| product_id  | name        | base_price  | tax_percentage  |
+-------------+-------------+-------------+-----------------+
| 1           | kitkat      | 0.99        | 19              |
| 2           | M&M         | 5.99        | 19              |
| 3           | milk        | 0.67        | 5               |
| 4           | Dr. Pepper  | 0.99        | 19              |
+-------------+-------------+-------------+-----------------+
#...done.
SET FOREIGN_KEY_CHECKS=1;
Test case 21 - GRID format with NAMES display
# Source on XXXX-XXXX: ... connected.
SET FOREIGN_KEY_CHECKS=0;
# NOTE : --display is ignored for data export.
# Exporting data from util_test
# Data for table `util_test`.`t1`:
+---------------------------------+
| a                               |
+---------------------------------+
| 01 Test Basic database example  |
| 02 Test Basic database example  |
| 03 Test Basic database example  |
| 04 Test Basic database example  |
| 05 Test Basic database example  |
| 06 Test Basic database example  |
| 07 Test Basic database example  |
+---------------------------------+
# Data for table `util_test`.`t2`:
+---------------------------------+------------------+
| a                               | x_blob           |
+---------------------------------+------------------+
| 11 Test Basic database example  | This is a blob.  |
| 12 Test Basic database example  | This is a blob.  |
| 13 Test Basic database example  | This is a blob.  |
| NULL                            | This is a blob.  |
+---------------------------------+------------------+
# Data for table `util_test`.`t3`:
+----+----------------+
| a  | b              |
+----+----------------+
| 1  | 14 test fkeys  |
| 2  | 15 test fkeys  |
| 3  | 16 test fkeys  |
| 4  | NULL           |
+----+----------------+
# Data for table `util_test`.`t4`:
+----+----+
| c  | d  |
+----+----+
| 3  | 2  |
+----+----+
# Data for table `util_test`.`t5`:
+-------------+-------------+-------------+-----------------+
| product_id  | name        | base_price  | tax_percentage  |
+-------------+-------------+-------------+-----------------+
| 1           | kitkat      | 0.99        | 19              |
| 2           | M&M         | 5.99        | 19              |
| 3           | milk        | 0.67        | 5               |
| 4           | Dr. Pepper  | 0.99        | 19              |
+-------------+-------------+-------------+-----------------+
#...done.
SET FOREIGN_KEY_CHECKS=1;
Test case 22 - CSV format with BRIEF display
# Source on XXXX-XXXX: ... connected.
SET FOREIGN_KEY_CHECKS=0;
# Exporting data from util_test
# Data for table `util_test`.`t1`:
`a`
01 Test Basic database example
02 Test Basic database example
03 Test Basic database example
04 Test Basic database example
05 Test Basic database example
06 Test Basic database example
07 Test Basic database example
# Data for table `util_test`.`t2`:
`a`,`x_blob`
11 Test Basic database example,This is a blob.
12 Test Basic database example,This is a blob.
13 Test Basic database example,This is a blob.
NULL,This is a blob.
# Data for table `util_test`.`t3`:
`a`,`b`
1,14 test fkeys
2,15 test fkeys
3,16 test fkeys
4,NULL
# Data for table `util_test`.`t4`:
`c`,`d`
3,2
# Data for table `util_test`.`t5`:
`product_id`,`name`,`base_price`,`tax_percentage`
1,kitkat,0.99,19
2,M&M,5.99,19
3,milk,0.67,5
4,Dr. Pepper,0.99,19
#...done.
SET FOREIGN_KEY_CHECKS=1;
Test case 23 - CSV format with FULL display
# Source on XXXX-XXXX: ... connected.
SET FOREIGN_KEY_CHECKS=0;
# NOTE : --display is ignored for data export.
# Exporting data from util_test
# Data for table `util_test`.`t1`:
`a`
01 Test Basic database example
02 Test Basic database example
03 Test Basic database example
04 Test Basic database example
05 Test Basic database example
06 Test Basic database example
07 Test Basic database example
# Data for table `util_test`.`t2`:
`a`,`x_blob`
11 Test Basic database example,This is a blob.
12 Test Basic database example,This is a blob.
13 Test Basic database example,This is a blob.
NULL,This is a blob.
# Data for table `util_test`.`t3`:
`a`,`b`
1,14 test fkeys
2,15 test fkeys
3,16 test fkeys
4,NULL
# Data for table `util_test`.`t4`:
`c`,`d`
3,2
# Data for table `util_test`.`t5`:
`product_id`,`name`,`base_price`,`tax_percentage`
1,kitkat,0.99,19
2,M&M,5.99,19
3,milk,0.67,5
4,Dr. Pepper,0.99,19
#...done.
SET FOREIGN_KEY_CHECKS=1;
Test case 24 - CSV format with NAMES display
# Source on XXXX-XXXX: ... connected.
SET FOREIGN_KEY_CHECKS=0;
# NOTE : --display is ignored for data export.
# Exporting data from util_test
# Data for table `util_test`.`t1`:
`a`
01 Test Basic database example
02 Test Basic database example
03 Test Basic database example
04 Test Basic database example
05 Test Basic database example
06 Test Basic database example
07 Test Basic database example
# Data for table `util_test`.`t2`:
`a`,`x_blob`
11 Test Basic database example,This is a blob.
12 Test Basic database example,This is a blob.
13 Test Basic database example,This is a blob.
NULL,This is a blob.
# Data for table `util_test`.`t3`:
`a`,`b`
1,14 test fkeys
2,15 test fkeys
3,16 test fkeys
4,NULL
# Data for table `util_test`.`t4`:
`c`,`d`
3,2
# Data for table `util_test`.`t5`:
`product_id`,`name`,`base_price`,`tax_percentage`
1,kitkat,0.99,19
2,M&M,5.99,19
3,milk,0.67,5
4,Dr. Pepper,0.99,19
#...done.
SET FOREIGN_KEY_CHECKS=1;
Test case 25 - TAB format with BRIEF display
# Source on XXXX-XXXX: ... connected.
SET FOREIGN_KEY_CHECKS=0;
# Exporting data from util_test
# Data for table `util_test`.`t1`:
`a`
01 Test Basic database example
02 Test Basic database example
03 Test Basic database example
04 Test Basic database example
05 Test Basic database example
06 Test Basic database example
07 Test Basic database example
# Data for table `util_test`.`t2`:
`a`	`x_blob`
11 Test Basic database example	This is a blob.
12 Test Basic database example	This is a blob.
13 Test Basic database example	This is a blob.
NULL	This is a blob.
# Data for table `util_test`.`t3`:
`a`	`b`
1	14 test fkeys
2	15 test fkeys
3	16 test fkeys
4	NULL
# Data for table `util_test`.`t4`:
`c`	`d`
3	2
# Data for table `util_test`.`t5`:
`product_id`	`name`	`base_price`	`tax_percentage`
1	kitkat	0.99	19
2	M&M	5.99	19
3	milk	0.67	5
4	Dr. Pepper	0.99	19
#...done.
SET FOREIGN_KEY_CHECKS=1;
Test case 26 - TAB format with FULL display
# Source on XXXX-XXXX: ... connected.
SET FOREIGN_KEY_CHECKS=0;
# NOTE : --display is ignored for data export.
# Exporting data from util_test
# Data for table `util_test`.`t1`:
`a`
01 Test Basic database example
02 Test Basic database example
03 Test Basic database example
04 Test Basic database example
05 Test Basic database example
06 Test Basic database example
07 Test Basic database example
# Data for table `util_test`.`t2`:
`a`	`x_blob`
11 Test Basic database example	This is a blob.
12 Test Basic database example	This is a blob.
13 Test Basic database example	This is a blob.
NULL	This is a blob.
# Data for table `util_test`.`t3`:
`a`	`b`
1	14 test fkeys
2	15 test fkeys
3	16 test fkeys
4	NULL
# Data for table `util_test`.`t4`:
`c`	`d`
3	2
# Data for table `util_test`.`t5`:
`product_id`	`name`	`base_price`	`tax_percentage`
1	kitkat	0.99	19
2	M&M	5.99	19
3	milk	0.67	5
4	Dr. Pepper	0.99	19
#...done.
SET FOREIGN_KEY_CHECKS=1;
Test case 27 - TAB format with NAMES display
# Source on XXXX-XXXX: ... connected.
SET FOREIGN_KEY_CHECKS=0;
# NOTE : --display is ignored for data export.
# Exporting data from util_test
# Data for table `util_test`.`t1`:
`a`
01 Test Basic database example
02 Test Basic database example
03 Test Basic database example
04 Test Basic database example
05 Test Basic database example
06 Test Basic database example
07 Test Basic database example
# Data for table `util_test`.`t2`:
`a`	`x_blob`
11 Test Basic database example	This is a blob.
12 Test Basic database example	This is a blob.
13 Test Basic database example	This is a blob.
NULL	This is a blob.
# Data for table `util_test`.`t3`:
`a`	`b`
1	14 test fkeys
2	15 test fkeys
3	16 test fkeys
4	NULL
# Data for table `util_test`.`t4`:
`c`	`d`
3	2
# Data for table `util_test`.`t5`:
`product_id`	`name`	`base_price`	`tax_percentage`
1	kitkat	0.99	19
2	M&M	5.99	19
3	milk	0.67	5
4	Dr. Pepper	0.99	19
#...done.
SET FOREIGN_KEY_CHECKS=1;
Test case 28 - VERTICAL format with BRIEF display
# Source on XXXX-XXXX: ... connected.
SET FOREIGN_KEY_CHECKS=0;
# Exporting data from util_test
# Data for table `util_test`.`t1`:
*************************       1. row *************************
 a: 01 Test Basic database example
*************************       2. row *************************
 a: 02 Test Basic database example
*************************       3. row *************************
 a: 03 Test Basic database example
*************************       4. row *************************
 a: 04 Test Basic database example
*************************       5. row *************************
 a: 05 Test Basic database example
*************************       6. row *************************
 a: 06 Test Basic database example
*************************       7. row *************************
 a: 07 Test Basic database example
7 rows.
# Data for table `util_test`.`t2`:
*************************       1. row *************************
      a: 11 Test Basic database example
 x_blob: This is a blob.
*************************       2. row *************************
      a: 12 Test Basic database example
 x_blob: This is a blob.
*************************       3. row *************************
      a: 13 Test Basic database example
 x_blob: This is a blob.
*************************       4. row *************************
      a: NULL
 x_blob: This is a blob.
4 rows.
# Data for table `util_test`.`t3`:
*************************       1. row *************************
 a: 1
 b: 14 test fkeys
*************************       2. row *************************
 a: 2
 b: 15 test fkeys
*************************       3. row *************************
 a: 3
 b: 16 test fkeys
*************************       4. row *************************
 a: 4
 b: NULL
4 rows.
# Data for table `util_test`.`t4`:
*************************       1. row *************************
 c: 3
 d: 2
1 row.
# Data for table `util_test`.`t5`:
*************************       1. row *************************
     product_id: 1
           name: kitkat
     base_price: 0.99
 tax_percentage: 19
*************************       2. row *************************
     product_id: 2
           name: M&M
     base_price: 5.99
 tax_percentage: 19
*************************       3. row *************************
     product_id: 3
           name: milk
     base_price: 0.67
 tax_percentage: 5
*************************       4. row *************************
     product_id: 4
           name: Dr. Pepper
     base_price: 0.99
 tax_percentage: 19
4 rows.
#...done.
SET FOREIGN_KEY_CHECKS=1;
Test case 29 - VERTICAL format with FULL display
# Source on XXXX-XXXX: ... connected.
SET FOREIGN_KEY_CHECKS=0;
# NOTE : --display is ignored for data export.
# Exporting data from util_test
# Data for table `util_test`.`t1`:
*************************       1. row *************************
 a: 01 Test Basic database example
*************************       2. row *************************
 a: 02 Test Basic database example
*************************       3. row *************************
 a: 03 Test Basic database example
*************************       4. row *************************
 a: 04 Test Basic database example
*************************       5. row *************************
 a: 05 Test Basic database example
*************************       6. row *************************
 a: 06 Test Basic database example
*************************       7. row *************************
 a: 07 Test Basic database example
7 rows.
# Data for table `util_test`.`t2`:
*************************       1. row *************************
      a: 11 Test Basic database example
 x_blob: This is a blob.
*************************       2. row *************************
      a: 12 Test Basic database example
 x_blob: This is a blob.
*************************       3. row *************************
      a: 13 Test Basic database example
 x_blob: This is a blob.
*************************       4. row *************************
      a: NULL
 x_blob: This is a blob.
4 rows.
# Data for table `util_test`.`t3`:
*************************       1. row *************************
 a: 1
 b: 14 test fkeys
*************************       2. row *************************
 a: 2
 b: 15 test fkeys
*************************       3. row *************************
 a: 3
 b: 16 test fkeys
*************************       4. row *************************
 a: 4
 b: NULL
4 rows.
# Data for table `util_test`.`t4`:
*************************       1. row *************************
 c: 3
 d: 2
1 row.
# Data for table `util_test`.`t5`:
*************************       1. row *************************
     product_id: 1
           name: kitkat
     base_price: 0.99
 tax_percentage: 19
*************************       2. row *************************
     product_id: 2
           name: M&M
     base_price: 5.99
 tax_percentage: 19
*************************       3. row *************************
     product_id: 3
           name: milk
     base_price: 0.67
 tax_percentage: 5
*************************       4. row *************************
     product_id: 4
           name: Dr. Pepper
     base_price: 0.99
 tax_percentage: 19
4 rows.
#...done.
SET FOREIGN_KEY_CHECKS=1;
Test case 30 - VERTICAL format with NAMES display
# Source on XXXX-XXXX: ... connected.
SET FOREIGN_KEY_CHECKS=0;
# NOTE : --display is ignored for data export.
# Exporting data from util_test
# Data for table `util_test`.`t1`:
*************************       1. row *************************
 a: 01 Test Basic database example
*************************       2. row *************************
 a: 02 Test Basic database example
*************************       3. row *************************
 a: 03 Test Basic database example
*************************       4. row *************************
 a: 04 Test Basic database example
*************************       5. row *************************
 a: 05 Test Basic database example
*************************       6. row *************************
 a: 06 Test Basic database example
*************************       7. row *************************
 a: 07 Test Basic database example
7 rows.
# Data for table `util_test`.`t2`:
*************************       1. row *************************
      a: 11 Test Basic database example
 x_blob: This is a blob.
*************************       2. row *************************
      a: 12 Test Basic database example
 x_blob: This is a blob.
*************************       3. row *************************
      a: 13 Test Basic database example
 x_blob: This is a blob.
*************************       4. row *************************
      a: NULL
 x_blob: This is a blob.
4 rows.
# Data for table `util_test`.`t3`:
*************************       1. row *************************
 a: 1
 b: 14 test fkeys
*************************       2. row *************************
 a: 2
 b: 15 test fkeys
*************************       3. row *************************
 a: 3
 b: 16 test fkeys
*************************       4. row *************************
 a: 4
 b: NULL
4 rows.
# Data for table `util_test`.`t4`:
*************************       1. row *************************
 c: 3
 d: 2
1 row.
# Data for table `util_test`.`t5`:
*************************       1. row *************************
     product_id: 1
           name: kitkat
     base_price: 0.99
 tax_percentage: 19
*************************       2. row *************************
     product_id: 2
           name: M&M
     base_price: 5.99
 tax_percentage: 19
*************************       3. row *************************
     product_id: 3
           name: milk
     base_price: 0.67
 tax_percentage: 5
*************************       4. row *************************
     product_id: 4
           name: Dr. Pepper
     base_price: 0.99
 tax_percentage: 19
4 rows.
#...done.
SET FOREIGN_KEY_CHECKS=1;
Test case 31 - multiple blobs
# Source on XXXX-XXXX: ... connected.
SET FOREIGN_KEY_CHECKS=0;
USE `util_test`;
# Exporting data from util_test
# Data for table `util_test`.`t1`:
INSERT INTO `util_test`.`t1` VALUES ('01 Test Basic database example');
INSERT INTO `util_test`.`t1` VALUES ('02 Test Basic database example');
INSERT INTO `util_test`.`t1` VALUES ('03 Test Basic database example');
INSERT INTO `util_test`.`t1` VALUES ('04 Test Basic database example');
INSERT INTO `util_test`.`t1` VALUES ('05 Test Basic database example');
INSERT INTO `util_test`.`t1` VALUES ('06 Test Basic database example');
INSERT INTO `util_test`.`t1` VALUES ('07 Test Basic database example');
# Data for table `util_test`.`t2`:
INSERT INTO `util_test`.`t2` VALUES ('11 Test Basic database example', NULL, NULL);
INSERT INTO `util_test`.`t2` VALUES ('12 Test Basic database example', NULL, NULL);
INSERT INTO `util_test`.`t2` VALUES ('13 Test Basic database example', NULL, NULL);
INSERT INTO `util_test`.`t2` VALUES (NULL, NULL, NULL);
# Blob data for table t2:
UPDATE `util_test`.`t2` SET `x_blob` = 'This is a blob.', `y_blob` = 'This is yet another blob.' WHERE `a` = '11 Test Basic database example';
UPDATE `util_test`.`t2` SET `x_blob` = 'This is a blob.', `y_blob` = 'This is yet another blob.' WHERE `a` = '11 Test Basic database example';
UPDATE `util_test`.`t2` SET `x_blob` = 'This is a blob.', `y_blob` = 'This is yet another blob.' WHERE `a` = '12 Test Basic database example';
UPDATE `util_test`.`t2` SET `x_blob` = 'This is a blob.', `y_blob` = 'This is yet another blob.' WHERE `a` = '12 Test Basic database example';
UPDATE `util_test`.`t2` SET `x_blob` = 'This is a blob.', `y_blob` = 'This is yet another blob.' WHERE `a` = '13 Test Basic database example';
UPDATE `util_test`.`t2` SET `x_blob` = 'This is a blob.', `y_blob` = 'This is yet another blob.' WHERE `a` = '13 Test Basic database example';
UPDATE `util_test`.`t2` SET `x_blob` = 'This is a blob.', `y_blob` = 'This is yet another blob.' WHERE `a` = NULL;
UPDATE `util_test`.`t2` SET `x_blob` = 'This is a blob.', `y_blob` = 'This is yet another blob.' WHERE `a` = NULL;
# Data for table `util_test`.`t3`:
INSERT INTO `util_test`.`t3` VALUES (1, '14 test fkeys');
INSERT INTO `util_test`.`t3` VALUES (2, '15 test fkeys');
INSERT INTO `util_test`.`t3` VALUES (3, '16 test fkeys');
INSERT INTO `util_test`.`t3` VALUES (4, NULL);
# Data for table `util_test`.`t4`:
INSERT INTO `util_test`.`t4` VALUES (3, 2);
# Data for table `util_test`.`t5`:
INSERT INTO `util_test`.`t5` VALUES (1, 'kitkat', 0.99, 19);
INSERT INTO `util_test`.`t5` VALUES (2, 'M&M', 5.99, 19);
INSERT INTO `util_test`.`t5` VALUES (3, 'milk', 0.67, 5);
INSERT INTO `util_test`.`t5` VALUES (4, 'Dr. Pepper', 0.99, 19);
#...done.
SET FOREIGN_KEY_CHECKS=1;
