Test case 1 - SQL single rows
# Source on localhost: ... connected.
USE `util_test`;
# Exporting data from util_test
# Data for table `util_test`.`t1`: 
INSERT INTO `util_test`.`t1` VALUES ('01 Test Basic database example');
INSERT INTO `util_test`.`t1` VALUES ('02 Test Basic database example');
INSERT INTO `util_test`.`t1` VALUES ('03 Test Basic database example');
INSERT INTO `util_test`.`t1` VALUES ('04 Test Basic database example');
INSERT INTO `util_test`.`t1` VALUES ('05 Test Basic database example');
INSERT INTO `util_test`.`t1` VALUES ('06 Test Basic database example');
INSERT INTO `util_test`.`t1` VALUES ('07 Test Basic database example');
# Data for table `util_test`.`t2`: 
INSERT INTO `util_test`.`t2` VALUES ('11 Test Basic database example', NULL);
INSERT INTO `util_test`.`t2` VALUES ('12 Test Basic database example', NULL);
INSERT INTO `util_test`.`t2` VALUES ('13 Test Basic database example', NULL);
# Blob data for table t2:
UPDATE `util_test`.`t2` SET `x_blob` = 'This is a blob.' WHERE `a` = '11 Test Basic database example' ;
UPDATE `util_test`.`t2` SET `x_blob` = 'This is a blob.' WHERE `a` = '12 Test Basic database example' ;
UPDATE `util_test`.`t2` SET `x_blob` = 'This is a blob.' WHERE `a` = '13 Test Basic database example' ;
# Data for table `util_test`.`t3`: 
INSERT INTO `util_test`.`t3` VALUES (1, '14 test fkeys');
INSERT INTO `util_test`.`t3` VALUES (2, '15 test fkeys');
INSERT INTO `util_test`.`t3` VALUES (3, '16 test fkeys');
# Data for table `util_test`.`t4`: 
INSERT INTO `util_test`.`t4` VALUES (3, 2);
#...done.
Test case 2 - SQL bulk insert
# Source on localhost: ... connected.
USE `util_test`;
# Exporting data from util_test
# Data for table `util_test`.`t1`: 
INSERT INTO `util_test`.`t1` VALUES  ('01 Test Basic database example'),  ('02 Test Basic database example'),  ('03 Test Basic database example'),  ('04 Test Basic database example'),  ('05 Test Basic database example'),  ('06 Test Basic database example'),  ('07 Test Basic database example');
# Data for table `util_test`.`t2`: 
INSERT INTO `util_test`.`t2` VALUES  ('11 Test Basic database example', NULL),  ('12 Test Basic database example', NULL),  ('13 Test Basic database example', NULL);
# Blob data for table t2:
UPDATE `util_test`.`t2` SET `x_blob` = 'This is a blob.' WHERE `a` = '11 Test Basic database example' ;
UPDATE `util_test`.`t2` SET `x_blob` = 'This is a blob.' WHERE `a` = '12 Test Basic database example' ;
UPDATE `util_test`.`t2` SET `x_blob` = 'This is a blob.' WHERE `a` = '13 Test Basic database example' ;
# Data for table `util_test`.`t3`: 
INSERT INTO `util_test`.`t3` VALUES  (1, '14 test fkeys'),  (2, '15 test fkeys'),  (3, '16 test fkeys');
# Data for table `util_test`.`t4`: 
INSERT INTO `util_test`.`t4` VALUES  (3, 2);
#...done.
Test case 3 - skip blobs
# Source on localhost: ... connected.
USE `util_test`;
# Exporting data from util_test
# Data for table `util_test`.`t1`: 
INSERT INTO `util_test`.`t1` VALUES ('01 Test Basic database example');
INSERT INTO `util_test`.`t1` VALUES ('02 Test Basic database example');
INSERT INTO `util_test`.`t1` VALUES ('03 Test Basic database example');
INSERT INTO `util_test`.`t1` VALUES ('04 Test Basic database example');
INSERT INTO `util_test`.`t1` VALUES ('05 Test Basic database example');
INSERT INTO `util_test`.`t1` VALUES ('06 Test Basic database example');
INSERT INTO `util_test`.`t1` VALUES ('07 Test Basic database example');
# Data for table `util_test`.`t2`: 
INSERT INTO `util_test`.`t2` VALUES ('11 Test Basic database example', NULL);
INSERT INTO `util_test`.`t2` VALUES ('12 Test Basic database example', NULL);
INSERT INTO `util_test`.`t2` VALUES ('13 Test Basic database example', NULL);
# WARNING : Table t2 has blob data that has been excluded by --skip-blobs.
# Data for table `util_test`.`t3`: 
INSERT INTO `util_test`.`t3` VALUES (1, '14 test fkeys');
INSERT INTO `util_test`.`t3` VALUES (2, '15 test fkeys');
INSERT INTO `util_test`.`t3` VALUES (3, '16 test fkeys');
# Data for table `util_test`.`t4`: 
INSERT INTO `util_test`.`t4` VALUES (3, 2);
#...done.
Test case 4 - sql format
# Source on localhost: ... connected.
USE `util_test`;
# Exporting data from util_test
# Data for table `util_test`.`t1`: 
INSERT INTO `util_test`.`t1` VALUES ('01 Test Basic database example');
INSERT INTO `util_test`.`t1` VALUES ('02 Test Basic database example');
INSERT INTO `util_test`.`t1` VALUES ('03 Test Basic database example');
INSERT INTO `util_test`.`t1` VALUES ('04 Test Basic database example');
INSERT INTO `util_test`.`t1` VALUES ('05 Test Basic database example');
INSERT INTO `util_test`.`t1` VALUES ('06 Test Basic database example');
INSERT INTO `util_test`.`t1` VALUES ('07 Test Basic database example');
# Data for table `util_test`.`t2`: 
INSERT INTO `util_test`.`t2` VALUES ('11 Test Basic database example', NULL);
INSERT INTO `util_test`.`t2` VALUES ('12 Test Basic database example', NULL);
INSERT INTO `util_test`.`t2` VALUES ('13 Test Basic database example', NULL);
# Blob data for table t2:
UPDATE `util_test`.`t2` SET `x_blob` = 'This is a blob.' WHERE `a` = '11 Test Basic database example' ;
UPDATE `util_test`.`t2` SET `x_blob` = 'This is a blob.' WHERE `a` = '12 Test Basic database example' ;
UPDATE `util_test`.`t2` SET `x_blob` = 'This is a blob.' WHERE `a` = '13 Test Basic database example' ;
# Data for table `util_test`.`t3`: 
INSERT INTO `util_test`.`t3` VALUES (1, '14 test fkeys');
INSERT INTO `util_test`.`t3` VALUES (2, '15 test fkeys');
INSERT INTO `util_test`.`t3` VALUES (3, '16 test fkeys');
# Data for table `util_test`.`t4`: 
INSERT INTO `util_test`.`t4` VALUES (3, 2);
#...done.
Test case 5 - csv format
# Source on localhost: ... connected.
# Exporting data from util_test
# Data for table `util_test`.`t1`: 
`a`
01 Test Basic database example
02 Test Basic database example
03 Test Basic database example
04 Test Basic database example
05 Test Basic database example
06 Test Basic database example
07 Test Basic database example
# Data for table `util_test`.`t2`: 
`a`,`x_blob`
11 Test Basic database example,This is a blob.
12 Test Basic database example,This is a blob.
13 Test Basic database example,This is a blob.
# Data for table `util_test`.`t3`: 
`a`,`b`
1,14 test fkeys
2,15 test fkeys
3,16 test fkeys
# Data for table `util_test`.`t4`: 
`c`,`d`
3,2
#...done.
Test case 6 - tab format
# Source on localhost: ... connected.
# Exporting data from util_test
# Data for table `util_test`.`t1`: 
`a`
01 Test Basic database example
02 Test Basic database example
03 Test Basic database example
04 Test Basic database example
05 Test Basic database example
06 Test Basic database example
07 Test Basic database example
# Data for table `util_test`.`t2`: 
`a`	`x_blob`
11 Test Basic database example	This is a blob.
12 Test Basic database example	This is a blob.
13 Test Basic database example	This is a blob.
# Data for table `util_test`.`t3`: 
`a`	`b`
1	14 test fkeys
2	15 test fkeys
3	16 test fkeys
# Data for table `util_test`.`t4`: 
`c`	`d`
3	2
#...done.
Test case 7 - GRID format
# Source on localhost: ... connected.
# Exporting data from util_test
# Data for table `util_test`.`t1`: 
+---------------------------------+
| a                               |
+---------------------------------+
| 01 Test Basic database example  |
| 02 Test Basic database example  |
| 03 Test Basic database example  |
| 04 Test Basic database example  |
| 05 Test Basic database example  |
| 06 Test Basic database example  |
| 07 Test Basic database example  |
+---------------------------------+
# Data for table `util_test`.`t2`: 
+---------------------------------+------------------+
| a                               | x_blob           |
+---------------------------------+------------------+
| 11 Test Basic database example  | This is a blob.  |
| 12 Test Basic database example  | This is a blob.  |
| 13 Test Basic database example  | This is a blob.  |
+---------------------------------+------------------+
# Data for table `util_test`.`t3`: 
+----+----------------+
| a  | b              |
+----+----------------+
| 1  | 14 test fkeys  |
| 2  | 15 test fkeys  |
| 3  | 16 test fkeys  |
+----+----------------+
# Data for table `util_test`.`t4`: 
+----+----+
| c  | d  |
+----+----+
| 3  | 2  |
+----+----+
#...done.
Test case 8 - VERTICAL format
# Source on localhost: ... connected.
# Exporting data from util_test
# Data for table `util_test`.`t1`: 
*************************       1. row *************************
 a: 01 Test Basic database example
*************************       2. row *************************
 a: 02 Test Basic database example
*************************       3. row *************************
 a: 03 Test Basic database example
*************************       4. row *************************
 a: 04 Test Basic database example
*************************       5. row *************************
 a: 05 Test Basic database example
*************************       6. row *************************
 a: 06 Test Basic database example
*************************       7. row *************************
 a: 07 Test Basic database example
7 rows.
# Data for table `util_test`.`t2`: 
*************************       1. row *************************
      a: 11 Test Basic database example
 x_blob: This is a blob.
*************************       2. row *************************
      a: 12 Test Basic database example
 x_blob: This is a blob.
*************************       3. row *************************
      a: 13 Test Basic database example
 x_blob: This is a blob.
3 rows.
# Data for table `util_test`.`t3`: 
*************************       1. row *************************
 a: 1
 b: 14 test fkeys
*************************       2. row *************************
 a: 2
 b: 15 test fkeys
*************************       3. row *************************
 a: 3
 b: 16 test fkeys
3 rows.
# Data for table `util_test`.`t4`: 
*************************       1. row *************************
 c: 3
 d: 2
1 rows.
#...done.
Test case 9 - sql format no headers
# Source on localhost: ... connected.
USE `util_test`;
# Exporting data from util_test
# Data for table `util_test`.`t1`: 
INSERT INTO `util_test`.`t1` VALUES ('01 Test Basic database example');
INSERT INTO `util_test`.`t1` VALUES ('02 Test Basic database example');
INSERT INTO `util_test`.`t1` VALUES ('03 Test Basic database example');
INSERT INTO `util_test`.`t1` VALUES ('04 Test Basic database example');
INSERT INTO `util_test`.`t1` VALUES ('05 Test Basic database example');
INSERT INTO `util_test`.`t1` VALUES ('06 Test Basic database example');
INSERT INTO `util_test`.`t1` VALUES ('07 Test Basic database example');
# Data for table `util_test`.`t2`: 
INSERT INTO `util_test`.`t2` VALUES ('11 Test Basic database example', NULL);
INSERT INTO `util_test`.`t2` VALUES ('12 Test Basic database example', NULL);
INSERT INTO `util_test`.`t2` VALUES ('13 Test Basic database example', NULL);
# Blob data for table t2:
UPDATE `util_test`.`t2` SET `x_blob` = 'This is a blob.' WHERE `a` = '11 Test Basic database example' ;
UPDATE `util_test`.`t2` SET `x_blob` = 'This is a blob.' WHERE `a` = '12 Test Basic database example' ;
UPDATE `util_test`.`t2` SET `x_blob` = 'This is a blob.' WHERE `a` = '13 Test Basic database example' ;
# Data for table `util_test`.`t3`: 
INSERT INTO `util_test`.`t3` VALUES (1, '14 test fkeys');
INSERT INTO `util_test`.`t3` VALUES (2, '15 test fkeys');
INSERT INTO `util_test`.`t3` VALUES (3, '16 test fkeys');
# Data for table `util_test`.`t4`: 
INSERT INTO `util_test`.`t4` VALUES (3, 2);
#...done.
Test case 10 - csv format no headers
# Source on localhost: ... connected.
# Exporting data from util_test
# Data for table `util_test`.`t1`: 
`a`
01 Test Basic database example
02 Test Basic database example
03 Test Basic database example
04 Test Basic database example
05 Test Basic database example
06 Test Basic database example
07 Test Basic database example
# Data for table `util_test`.`t2`: 
`a`,`x_blob`
11 Test Basic database example,This is a blob.
12 Test Basic database example,This is a blob.
13 Test Basic database example,This is a blob.
# Data for table `util_test`.`t3`: 
`a`,`b`
1,14 test fkeys
2,15 test fkeys
3,16 test fkeys
# Data for table `util_test`.`t4`: 
`c`,`d`
3,2
#...done.
Test case 11 - tab format no headers
# Source on localhost: ... connected.
# Exporting data from util_test
# Data for table `util_test`.`t1`: 
`a`
01 Test Basic database example
02 Test Basic database example
03 Test Basic database example
04 Test Basic database example
05 Test Basic database example
06 Test Basic database example
07 Test Basic database example
# Data for table `util_test`.`t2`: 
`a`	`x_blob`
11 Test Basic database example	This is a blob.
12 Test Basic database example	This is a blob.
13 Test Basic database example	This is a blob.
# Data for table `util_test`.`t3`: 
`a`	`b`
1	14 test fkeys
2	15 test fkeys
3	16 test fkeys
# Data for table `util_test`.`t4`: 
`c`	`d`
3	2
#...done.
Test case 12 - GRID format no headers
# Source on localhost: ... connected.
# Exporting data from util_test
# Data for table `util_test`.`t1`: 
+---------------------------------+
| a                               |
+---------------------------------+
| 01 Test Basic database example  |
| 02 Test Basic database example  |
| 03 Test Basic database example  |
| 04 Test Basic database example  |
| 05 Test Basic database example  |
| 06 Test Basic database example  |
| 07 Test Basic database example  |
+---------------------------------+
# Data for table `util_test`.`t2`: 
+---------------------------------+------------------+
| a                               | x_blob           |
+---------------------------------+------------------+
| 11 Test Basic database example  | This is a blob.  |
| 12 Test Basic database example  | This is a blob.  |
| 13 Test Basic database example  | This is a blob.  |
+---------------------------------+------------------+
# Data for table `util_test`.`t3`: 
+----+----------------+
| a  | b              |
+----+----------------+
| 1  | 14 test fkeys  |
| 2  | 15 test fkeys  |
| 3  | 16 test fkeys  |
+----+----------------+
# Data for table `util_test`.`t4`: 
+----+----+
| c  | d  |
+----+----+
| 3  | 2  |
+----+----+
#...done.
Test case 13 - VERTICAL format no headers
# Source on localhost: ... connected.
# Exporting data from util_test
# Data for table `util_test`.`t1`: 
*************************       1. row *************************
 a: 01 Test Basic database example
*************************       2. row *************************
 a: 02 Test Basic database example
*************************       3. row *************************
 a: 03 Test Basic database example
*************************       4. row *************************
 a: 04 Test Basic database example
*************************       5. row *************************
 a: 05 Test Basic database example
*************************       6. row *************************
 a: 06 Test Basic database example
*************************       7. row *************************
 a: 07 Test Basic database example
7 rows.
# Data for table `util_test`.`t2`: 
*************************       1. row *************************
      a: 11 Test Basic database example
 x_blob: This is a blob.
*************************       2. row *************************
      a: 12 Test Basic database example
 x_blob: This is a blob.
*************************       3. row *************************
      a: 13 Test Basic database example
 x_blob: This is a blob.
3 rows.
# Data for table `util_test`.`t3`: 
*************************       1. row *************************
 a: 1
 b: 14 test fkeys
*************************       2. row *************************
 a: 2
 b: 15 test fkeys
*************************       3. row *************************
 a: 3
 b: 16 test fkeys
3 rows.
# Data for table `util_test`.`t4`: 
*************************       1. row *************************
 c: 3
 d: 2
1 rows.
#...done.
Test case 14 - SQ format
# Source on localhost: ... connected.
USE `util_test`;
# Exporting data from util_test
# Data for table `util_test`.`t1`: 
INSERT INTO `util_test`.`t1` VALUES ('01 Test Basic database example');
INSERT INTO `util_test`.`t1` VALUES ('02 Test Basic database example');
INSERT INTO `util_test`.`t1` VALUES ('03 Test Basic database example');
INSERT INTO `util_test`.`t1` VALUES ('04 Test Basic database example');
INSERT INTO `util_test`.`t1` VALUES ('05 Test Basic database example');
INSERT INTO `util_test`.`t1` VALUES ('06 Test Basic database example');
INSERT INTO `util_test`.`t1` VALUES ('07 Test Basic database example');
# Data for table `util_test`.`t2`: 
INSERT INTO `util_test`.`t2` VALUES ('11 Test Basic database example', NULL);
INSERT INTO `util_test`.`t2` VALUES ('12 Test Basic database example', NULL);
INSERT INTO `util_test`.`t2` VALUES ('13 Test Basic database example', NULL);
# Blob data for table t2:
UPDATE `util_test`.`t2` SET `x_blob` = 'This is a blob.' WHERE `a` = '11 Test Basic database example' ;
UPDATE `util_test`.`t2` SET `x_blob` = 'This is a blob.' WHERE `a` = '12 Test Basic database example' ;
UPDATE `util_test`.`t2` SET `x_blob` = 'This is a blob.' WHERE `a` = '13 Test Basic database example' ;
# Data for table `util_test`.`t3`: 
INSERT INTO `util_test`.`t3` VALUES (1, '14 test fkeys');
INSERT INTO `util_test`.`t3` VALUES (2, '15 test fkeys');
INSERT INTO `util_test`.`t3` VALUES (3, '16 test fkeys');
# Data for table `util_test`.`t4`: 
INSERT INTO `util_test`.`t4` VALUES (3, 2);
#...done.
Test case 15 - CS format
# Source on localhost: ... connected.
# Exporting data from util_test
# Data for table `util_test`.`t1`: 
`a`
01 Test Basic database example
02 Test Basic database example
03 Test Basic database example
04 Test Basic database example
05 Test Basic database example
06 Test Basic database example
07 Test Basic database example
# Data for table `util_test`.`t2`: 
`a`,`x_blob`
11 Test Basic database example,This is a blob.
12 Test Basic database example,This is a blob.
13 Test Basic database example,This is a blob.
# Data for table `util_test`.`t3`: 
`a`,`b`
1,14 test fkeys
2,15 test fkeys
3,16 test fkeys
# Data for table `util_test`.`t4`: 
`c`,`d`
3,2
#...done.
Test case 16 - ta format
# Source on localhost: ... connected.
# Exporting data from util_test
# Data for table `util_test`.`t1`: 
`a`
01 Test Basic database example
02 Test Basic database example
03 Test Basic database example
04 Test Basic database example
05 Test Basic database example
06 Test Basic database example
07 Test Basic database example
# Data for table `util_test`.`t2`: 
`a`	`x_blob`
11 Test Basic database example	This is a blob.
12 Test Basic database example	This is a blob.
13 Test Basic database example	This is a blob.
# Data for table `util_test`.`t3`: 
`a`	`b`
1	14 test fkeys
2	15 test fkeys
3	16 test fkeys
# Data for table `util_test`.`t4`: 
`c`	`d`
3	2
#...done.
Test case 17 - g format
# Source on localhost: ... connected.
# Exporting data from util_test
# Data for table `util_test`.`t1`: 
+---------------------------------+
| a                               |
+---------------------------------+
| 01 Test Basic database example  |
| 02 Test Basic database example  |
| 03 Test Basic database example  |
| 04 Test Basic database example  |
| 05 Test Basic database example  |
| 06 Test Basic database example  |
| 07 Test Basic database example  |
+---------------------------------+
# Data for table `util_test`.`t2`: 
+---------------------------------+------------------+
| a                               | x_blob           |
+---------------------------------+------------------+
| 11 Test Basic database example  | This is a blob.  |
| 12 Test Basic database example  | This is a blob.  |
| 13 Test Basic database example  | This is a blob.  |
+---------------------------------+------------------+
# Data for table `util_test`.`t3`: 
+----+----------------+
| a  | b              |
+----+----------------+
| 1  | 14 test fkeys  |
| 2  | 15 test fkeys  |
| 3  | 16 test fkeys  |
+----+----------------+
# Data for table `util_test`.`t4`: 
+----+----+
| c  | d  |
+----+----+
| 3  | 2  |
+----+----+
#...done.
Test case 18 - v format
# Source on localhost: ... connected.
# Exporting data from util_test
# Data for table `util_test`.`t1`: 
*************************       1. row *************************
 a: 01 Test Basic database example
*************************       2. row *************************
 a: 02 Test Basic database example
*************************       3. row *************************
 a: 03 Test Basic database example
*************************       4. row *************************
 a: 04 Test Basic database example
*************************       5. row *************************
 a: 05 Test Basic database example
*************************       6. row *************************
 a: 06 Test Basic database example
*************************       7. row *************************
 a: 07 Test Basic database example
7 rows.
# Data for table `util_test`.`t2`: 
*************************       1. row *************************
      a: 11 Test Basic database example
 x_blob: This is a blob.
*************************       2. row *************************
      a: 12 Test Basic database example
 x_blob: This is a blob.
*************************       3. row *************************
      a: 13 Test Basic database example
 x_blob: This is a blob.
3 rows.
# Data for table `util_test`.`t3`: 
*************************       1. row *************************
 a: 1
 b: 14 test fkeys
*************************       2. row *************************
 a: 2
 b: 15 test fkeys
*************************       3. row *************************
 a: 3
 b: 16 test fkeys
3 rows.
# Data for table `util_test`.`t4`: 
*************************       1. row *************************
 c: 3
 d: 2
1 rows.
#...done.
Test case 19 - GRID format with BRIEF display
# Source on localhost: ... connected.
# Exporting data from util_test
# Data for table `util_test`.`t1`: 
+---------------------------------+
| a                               |
+---------------------------------+
| 01 Test Basic database example  |
| 02 Test Basic database example  |
| 03 Test Basic database example  |
| 04 Test Basic database example  |
| 05 Test Basic database example  |
| 06 Test Basic database example  |
| 07 Test Basic database example  |
+---------------------------------+
# Data for table `util_test`.`t2`: 
+---------------------------------+------------------+
| a                               | x_blob           |
+---------------------------------+------------------+
| 11 Test Basic database example  | This is a blob.  |
| 12 Test Basic database example  | This is a blob.  |
| 13 Test Basic database example  | This is a blob.  |
+---------------------------------+------------------+
# Data for table `util_test`.`t3`: 
+----+----------------+
| a  | b              |
+----+----------------+
| 1  | 14 test fkeys  |
| 2  | 15 test fkeys  |
| 3  | 16 test fkeys  |
+----+----------------+
# Data for table `util_test`.`t4`: 
+----+----+
| c  | d  |
+----+----+
| 3  | 2  |
+----+----+
#...done.
Test case 20 - GRID format with FULL display
# Source on localhost: ... connected.
# NOTE : --display is ignored for data export.
# Exporting data from util_test
# Data for table `util_test`.`t1`: 
+---------------------------------+
| a                               |
+---------------------------------+
| 01 Test Basic database example  |
| 02 Test Basic database example  |
| 03 Test Basic database example  |
| 04 Test Basic database example  |
| 05 Test Basic database example  |
| 06 Test Basic database example  |
| 07 Test Basic database example  |
+---------------------------------+
# Data for table `util_test`.`t2`: 
+---------------------------------+------------------+
| a                               | x_blob           |
+---------------------------------+------------------+
| 11 Test Basic database example  | This is a blob.  |
| 12 Test Basic database example  | This is a blob.  |
| 13 Test Basic database example  | This is a blob.  |
+---------------------------------+------------------+
# Data for table `util_test`.`t3`: 
+----+----------------+
| a  | b              |
+----+----------------+
| 1  | 14 test fkeys  |
| 2  | 15 test fkeys  |
| 3  | 16 test fkeys  |
+----+----------------+
# Data for table `util_test`.`t4`: 
+----+----+
| c  | d  |
+----+----+
| 3  | 2  |
+----+----+
#...done.
Test case 21 - GRID format with NAMES display
# Source on localhost: ... connected.
# NOTE : --display is ignored for data export.
# Exporting data from util_test
# Data for table `util_test`.`t1`: 
+---------------------------------+
| a                               |
+---------------------------------+
| 01 Test Basic database example  |
| 02 Test Basic database example  |
| 03 Test Basic database example  |
| 04 Test Basic database example  |
| 05 Test Basic database example  |
| 06 Test Basic database example  |
| 07 Test Basic database example  |
+---------------------------------+
# Data for table `util_test`.`t2`: 
+---------------------------------+------------------+
| a                               | x_blob           |
+---------------------------------+------------------+
| 11 Test Basic database example  | This is a blob.  |
| 12 Test Basic database example  | This is a blob.  |
| 13 Test Basic database example  | This is a blob.  |
+---------------------------------+------------------+
# Data for table `util_test`.`t3`: 
+----+----------------+
| a  | b              |
+----+----------------+
| 1  | 14 test fkeys  |
| 2  | 15 test fkeys  |
| 3  | 16 test fkeys  |
+----+----------------+
# Data for table `util_test`.`t4`: 
+----+----+
| c  | d  |
+----+----+
| 3  | 2  |
+----+----+
#...done.
Test case 22 - CSV format with BRIEF display
# Source on localhost: ... connected.
# Exporting data from util_test
# Data for table `util_test`.`t1`: 
`a`
01 Test Basic database example
02 Test Basic database example
03 Test Basic database example
04 Test Basic database example
05 Test Basic database example
06 Test Basic database example
07 Test Basic database example
# Data for table `util_test`.`t2`: 
`a`,`x_blob`
11 Test Basic database example,This is a blob.
12 Test Basic database example,This is a blob.
13 Test Basic database example,This is a blob.
# Data for table `util_test`.`t3`: 
`a`,`b`
1,14 test fkeys
2,15 test fkeys
3,16 test fkeys
# Data for table `util_test`.`t4`: 
`c`,`d`
3,2
#...done.
Test case 23 - CSV format with FULL display
# Source on localhost: ... connected.
# NOTE : --display is ignored for data export.
# Exporting data from util_test
# Data for table `util_test`.`t1`: 
`a`
01 Test Basic database example
02 Test Basic database example
03 Test Basic database example
04 Test Basic database example
05 Test Basic database example
06 Test Basic database example
07 Test Basic database example
# Data for table `util_test`.`t2`: 
`a`,`x_blob`
11 Test Basic database example,This is a blob.
12 Test Basic database example,This is a blob.
13 Test Basic database example,This is a blob.
# Data for table `util_test`.`t3`: 
`a`,`b`
1,14 test fkeys
2,15 test fkeys
3,16 test fkeys
# Data for table `util_test`.`t4`: 
`c`,`d`
3,2
#...done.
Test case 24 - CSV format with NAMES display
# Source on localhost: ... connected.
# NOTE : --display is ignored for data export.
# Exporting data from util_test
# Data for table `util_test`.`t1`: 
`a`
01 Test Basic database example
02 Test Basic database example
03 Test Basic database example
04 Test Basic database example
05 Test Basic database example
06 Test Basic database example
07 Test Basic database example
# Data for table `util_test`.`t2`: 
`a`,`x_blob`
11 Test Basic database example,This is a blob.
12 Test Basic database example,This is a blob.
13 Test Basic database example,This is a blob.
# Data for table `util_test`.`t3`: 
`a`,`b`
1,14 test fkeys
2,15 test fkeys
3,16 test fkeys
# Data for table `util_test`.`t4`: 
`c`,`d`
3,2
#...done.
Test case 25 - TAB format with BRIEF display
# Source on localhost: ... connected.
# Exporting data from util_test
# Data for table `util_test`.`t1`: 
`a`
01 Test Basic database example
02 Test Basic database example
03 Test Basic database example
04 Test Basic database example
05 Test Basic database example
06 Test Basic database example
07 Test Basic database example
# Data for table `util_test`.`t2`: 
`a`	`x_blob`
11 Test Basic database example	This is a blob.
12 Test Basic database example	This is a blob.
13 Test Basic database example	This is a blob.
# Data for table `util_test`.`t3`: 
`a`	`b`
1	14 test fkeys
2	15 test fkeys
3	16 test fkeys
# Data for table `util_test`.`t4`: 
`c`	`d`
3	2
#...done.
Test case 26 - TAB format with FULL display
# Source on localhost: ... connected.
# NOTE : --display is ignored for data export.
# Exporting data from util_test
# Data for table `util_test`.`t1`: 
`a`
01 Test Basic database example
02 Test Basic database example
03 Test Basic database example
04 Test Basic database example
05 Test Basic database example
06 Test Basic database example
07 Test Basic database example
# Data for table `util_test`.`t2`: 
`a`	`x_blob`
11 Test Basic database example	This is a blob.
12 Test Basic database example	This is a blob.
13 Test Basic database example	This is a blob.
# Data for table `util_test`.`t3`: 
`a`	`b`
1	14 test fkeys
2	15 test fkeys
3	16 test fkeys
# Data for table `util_test`.`t4`: 
`c`	`d`
3	2
#...done.
Test case 27 - TAB format with NAMES display
# Source on localhost: ... connected.
# NOTE : --display is ignored for data export.
# Exporting data from util_test
# Data for table `util_test`.`t1`: 
`a`
01 Test Basic database example
02 Test Basic database example
03 Test Basic database example
04 Test Basic database example
05 Test Basic database example
06 Test Basic database example
07 Test Basic database example
# Data for table `util_test`.`t2`: 
`a`	`x_blob`
11 Test Basic database example	This is a blob.
12 Test Basic database example	This is a blob.
13 Test Basic database example	This is a blob.
# Data for table `util_test`.`t3`: 
`a`	`b`
1	14 test fkeys
2	15 test fkeys
3	16 test fkeys
# Data for table `util_test`.`t4`: 
`c`	`d`
3	2
#...done.
Test case 28 - VERTICAL format with BRIEF display
# Source on localhost: ... connected.
# Exporting data from util_test
# Data for table `util_test`.`t1`: 
*************************       1. row *************************
 a: 01 Test Basic database example
*************************       2. row *************************
 a: 02 Test Basic database example
*************************       3. row *************************
 a: 03 Test Basic database example
*************************       4. row *************************
 a: 04 Test Basic database example
*************************       5. row *************************
 a: 05 Test Basic database example
*************************       6. row *************************
 a: 06 Test Basic database example
*************************       7. row *************************
 a: 07 Test Basic database example
7 rows.
# Data for table `util_test`.`t2`: 
*************************       1. row *************************
      a: 11 Test Basic database example
 x_blob: This is a blob.
*************************       2. row *************************
      a: 12 Test Basic database example
 x_blob: This is a blob.
*************************       3. row *************************
      a: 13 Test Basic database example
 x_blob: This is a blob.
3 rows.
# Data for table `util_test`.`t3`: 
*************************       1. row *************************
 a: 1
 b: 14 test fkeys
*************************       2. row *************************
 a: 2
 b: 15 test fkeys
*************************       3. row *************************
 a: 3
 b: 16 test fkeys
3 rows.
# Data for table `util_test`.`t4`: 
*************************       1. row *************************
 c: 3
 d: 2
1 rows.
#...done.
Test case 29 - VERTICAL format with FULL display
# Source on localhost: ... connected.
# NOTE : --display is ignored for data export.
# Exporting data from util_test
# Data for table `util_test`.`t1`: 
*************************       1. row *************************
 a: 01 Test Basic database example
*************************       2. row *************************
 a: 02 Test Basic database example
*************************       3. row *************************
 a: 03 Test Basic database example
*************************       4. row *************************
 a: 04 Test Basic database example
*************************       5. row *************************
 a: 05 Test Basic database example
*************************       6. row *************************
 a: 06 Test Basic database example
*************************       7. row *************************
 a: 07 Test Basic database example
7 rows.
# Data for table `util_test`.`t2`: 
*************************       1. row *************************
      a: 11 Test Basic database example
 x_blob: This is a blob.
*************************       2. row *************************
      a: 12 Test Basic database example
 x_blob: This is a blob.
*************************       3. row *************************
      a: 13 Test Basic database example
 x_blob: This is a blob.
3 rows.
# Data for table `util_test`.`t3`: 
*************************       1. row *************************
 a: 1
 b: 14 test fkeys
*************************       2. row *************************
 a: 2
 b: 15 test fkeys
*************************       3. row *************************
 a: 3
 b: 16 test fkeys
3 rows.
# Data for table `util_test`.`t4`: 
*************************       1. row *************************
 c: 3
 d: 2
1 rows.
#...done.
Test case 30 - VERTICAL format with NAMES display
# Source on localhost: ... connected.
# NOTE : --display is ignored for data export.
# Exporting data from util_test
# Data for table `util_test`.`t1`: 
*************************       1. row *************************
 a: 01 Test Basic database example
*************************       2. row *************************
 a: 02 Test Basic database example
*************************       3. row *************************
 a: 03 Test Basic database example
*************************       4. row *************************
 a: 04 Test Basic database example
*************************       5. row *************************
 a: 05 Test Basic database example
*************************       6. row *************************
 a: 06 Test Basic database example
*************************       7. row *************************
 a: 07 Test Basic database example
7 rows.
# Data for table `util_test`.`t2`: 
*************************       1. row *************************
      a: 11 Test Basic database example
 x_blob: This is a blob.
*************************       2. row *************************
      a: 12 Test Basic database example
 x_blob: This is a blob.
*************************       3. row *************************
      a: 13 Test Basic database example
 x_blob: This is a blob.
3 rows.
# Data for table `util_test`.`t3`: 
*************************       1. row *************************
 a: 1
 b: 14 test fkeys
*************************       2. row *************************
 a: 2
 b: 15 test fkeys
*************************       3. row *************************
 a: 3
 b: 16 test fkeys
3 rows.
# Data for table `util_test`.`t4`: 
*************************       1. row *************************
 c: 3
 d: 2
1 rows.
#...done.
Test case 31 - multiple blobs
# Source on localhost: ... connected.
USE `util_test`;
# Exporting data from util_test
# Data for table `util_test`.`t1`: 
INSERT INTO `util_test`.`t1` VALUES ('01 Test Basic database example');
INSERT INTO `util_test`.`t1` VALUES ('02 Test Basic database example');
INSERT INTO `util_test`.`t1` VALUES ('03 Test Basic database example');
INSERT INTO `util_test`.`t1` VALUES ('04 Test Basic database example');
INSERT INTO `util_test`.`t1` VALUES ('05 Test Basic database example');
INSERT INTO `util_test`.`t1` VALUES ('06 Test Basic database example');
INSERT INTO `util_test`.`t1` VALUES ('07 Test Basic database example');
# Data for table `util_test`.`t2`: 
INSERT INTO `util_test`.`t2` VALUES ('11 Test Basic database example', NULL, NULL);
INSERT INTO `util_test`.`t2` VALUES ('12 Test Basic database example', NULL, NULL);
INSERT INTO `util_test`.`t2` VALUES ('13 Test Basic database example', NULL, NULL);
# Blob data for table t2:
UPDATE `util_test`.`t2` SET `x_blob` = 'This is a blob.', `y_blob` = 'This is yet another blob.' WHERE `a` = '11 Test Basic database example' ;
UPDATE `util_test`.`t2` SET `x_blob` = 'This is a blob.', `y_blob` = 'This is yet another blob.' WHERE `a` = '11 Test Basic database example' ;
UPDATE `util_test`.`t2` SET `x_blob` = 'This is a blob.', `y_blob` = 'This is yet another blob.' WHERE `a` = '12 Test Basic database example' ;
UPDATE `util_test`.`t2` SET `x_blob` = 'This is a blob.', `y_blob` = 'This is yet another blob.' WHERE `a` = '12 Test Basic database example' ;
UPDATE `util_test`.`t2` SET `x_blob` = 'This is a blob.', `y_blob` = 'This is yet another blob.' WHERE `a` = '13 Test Basic database example' ;
UPDATE `util_test`.`t2` SET `x_blob` = 'This is a blob.', `y_blob` = 'This is yet another blob.' WHERE `a` = '13 Test Basic database example' ;
# Data for table `util_test`.`t3`: 
INSERT INTO `util_test`.`t3` VALUES (1, '14 test fkeys');
INSERT INTO `util_test`.`t3` VALUES (2, '15 test fkeys');
INSERT INTO `util_test`.`t3` VALUES (3, '16 test fkeys');
# Data for table `util_test`.`t4`: 
INSERT INTO `util_test`.`t4` VALUES (3, 2);
#...done.
